{
  "vuln_id": "V-269342",
  "rule_id": "SV-269342r1050224_rule",
  "stig_id": "ALMA-09-029720",
  "severity": "medium",
  "severity_category": "CAT II",
  "weight": "10.0",
  "title": "AlmaLinux OS 9 must be configured to disable Bluetooth.",
  "group_title": "SRG-OS-000095-GPOS-00049",
  "idents": {
    "cci": [
      "CCI-000381"
    ]
  },
  "check_id": "C-73373r1049520_chk",
  "check_content": "Verify that AlmaLinux OS 9 disables the ability to load the Bluetooth kernel module with the following command:\n\n$ grep -r bluetooth /etc/modprobe.conf /etc/modprobe.d/* \n\n/etc/modprobe.d/bluetooth.conf:install bluetooth /bin/false\n/etc/modprobe.d/bluetooth.conf:blacklist bluetooth\n\nIf the command does not return any output, or the line is commented out, and use of Bluetooth is not documented with the information system security officer (ISSO) as an operational requirement, this is a finding.",
  "fixtext": "To configure the system to prevent the Bluetooth kernel module from being loaded, run the following command:\n\n$ cat << EOF | tee  /etc/modprobe.d/bluetooth.conf \ninstall bluetooth /bin/false\nblacklist bluetooth\nEOF",
  "fix_id": "F-73274r1048403_fix",
  "VulnDiscussion": "This requirement applies to wireless peripheral technologies (e.g., wireless mice, keyboards, displays, etc.) used with AlmaLinux OS 9 systems.\n\nWireless peripherals (e.g., Wi-Fi/Bluetooth/IR keyboards, mice and pointing devices, and near field communications [NFC]) present a unique challenge by creating an open, unsecured port on a computer. Wireless peripherals must meet DOD requirements for wireless data transmission and be approved for use by the authorizing official (AO). Even though some wireless peripherals, such as mice and pointing devices, do not ordinarily carry information that need to be protected, modification of communications with these wireless peripherals may be used to compromise the AlmaLinux OS 9 operating system.",
  "Documentable": "false"
}
