{
  "vuln_id": "V-272888",
  "rule_id": "SV-272888r1119411_rule",
  "stig_id": "MSDE-00-000400",
  "severity": "medium",
  "severity_category": "CAT II",
  "weight": "10.0",
  "title": "Microsoft Defender for Endpoint (MDE) must enable Endpoint Detection and Response (EDR) in block mode.",
  "group_title": "SRG-APP-000246",
  "idents": {
    "cci": [
      "CCI-001094",
      "CCI-002385"
    ]
  },
  "check_id": "C-76979r1119365_chk",
  "check_content": "Access the MDE portal as a user with at least an MDE Administrator or equivalent role:\n\n1. In the navigation pane, select Settings >> Endpoints >> Advanced features (under General).\n2. Verify the slide bar for \"Enable EDR in block mode\" is set to \"On\".\n\nIf the slide bar for \"Enable EDR in block mode\" is not set to \"On\", this is a finding.",
  "fixtext": "Access the MDE portal as a user with at least an MDE Administrator or equivalent role:\n\n1. In the navigation pane, select Settings >> Endpoints >> Advanced features (under General).\n2. Set the slide bar for \"Enable EDR in block mode\" to \"On\".",
  "fix_id": "F-76884r1119299_fix",
  "VulnDiscussion": "Denial of service (DoS) is a condition in which a resource is not available for legitimate users. When this occurs, the organization either cannot accomplish its mission or must operate at degraded capacity. \n\nIndividuals of concern can include hostile insiders or external adversaries that have successfully breached the information system and are using the system as a platform to launch cyberattacks on third parties.\n\nApplications and application developers must take the steps needed to ensure users cannot use an authorized application to launch DoS attacks against other systems and networks. For example, applications may include mechanisms that throttle network traffic so users are not able to generate unlimited network traffic via the application. Limiting system resources allocated to any user to a bare minimum may also reduce the ability of users to launch some DoS attacks.\n\nThe methods employed to counter this risk will be dependent upon the application layer methods that can be used to exploit it.\n\nSatisfies: SRG-APP-000246, SRG-APP-000435",
  "Documentable": "false"
}
