{
  "vuln_id": "V-259365",
  "rule_id": "SV-259365r960735_rule",
  "stig_id": "WDNS-22-000037",
  "severity": "medium",
  "severity_category": "CAT II",
  "weight": "10.0",
  "title": "The Windows DNS primary server must only send zone transfers to a specific list of secondary name servers.",
  "group_title": "SRG-APP-000001-DNS-000001",
  "idents": {
    "cci": [
      "CCI-000054"
    ]
  },
  "check_id": "C-63104r939798_chk",
  "check_content": "If the DNS server hosts only AD-integrated zones and there are no non-AD-integrated DNS servers acting as secondary DNS servers for the zones, this check is not applicable.\n\nFor a non-AD-integrated DNS server:\n\nLog on to the DNS server using the Domain Admin or Enterprise Admin account or Local Administrator account.\n\nPress the Windows key + R and execute \"dnsmgmt.msc\".\n\nOn the opened DNS Manager snap-in from the left pane, expand the server name for the DNS server, and then expand \"Forward Lookup Zones\".\n\nFrom the expanded list, click to select and then right-click the zone name.\n\nFrom the displayed context menu, click the \"Properties\" option.\n\nOn the opened zone's properties box, go to the \"Zone Transfers\" tab.\n\nOn the displayed interface, determine if the \"Allow zone transfers\" check box is selected.\n\nIf the \"Allow zone transfers\" check box is not selected, this is not a finding.\n\nIf the \"Allow zone transfers\" check box is selected, determine if either the \"Only to servers listed on the Name Servers tab\" radio button is selected or the \"Only to the following servers\" radio button is selected.\n\nIf the \"To any server\" radio button is selected, this is a finding.",
  "fixtext": "Log on to the DNS server using the Domain Admin or Enterprise Admin account or Local Administrator account.\n\nPress the Windows key + R and execute \"dnsmgmt.msc\".\n\nOn the opened DNS Manager snap-in from the left pane, expand the server name and then expand \"Forward Lookup Zones\".\n\nFrom the expanded list, click to select the zone.\n\nFrom the displayed context menu, click the \"Properties\" option.\n\nOn the opened zone's properties box, go to the \"Zone Transfers\" tab.\n\nOn the displayed interface, select the \"Allow zone transfers\" check box.\n\nSelect the \"Only to servers listed on the Name Servers tab\" radio button OR select the \"Only to the following servers\" radio button.\n\nClick \"Apply\".\n\nClick \"OK\".",
  "fix_id": "F-63012r939799_fix",
  "VulnDiscussion": "Primary name servers also make outbound connection to secondary name servers to provide zone transfers and accept inbound connection requests from clients wishing to provide a dynamic update. Primary name servers should explicitly limit zone transfers to be made only to designated secondary name servers. Because zone transfers involve the transfer of entire zones and use TCP connections, they place substantial demands on network resources relative to normal DNS queries. Errant or malicious frequent zone transfer requests on the name servers of the enterprise can overload the master zone server and result in a denial of service to legitimate users.\n\nActive Directory (AD)-integrated DNS servers replicate zone information via AD replication. Non-AD-integrated DNS servers replicate zone information via zone transfers.",
  "Documentable": "false"
}
