{
  "vuln_id": "V-216536",
  "rule_id": "SV-216536r961446_rule",
  "stig_id": "CISC-ND-001040",
  "severity": "medium",
  "severity_category": "CAT II",
  "weight": "10.0",
  "title": "The Cisco router must record time stamps for audit records that meet a granularity of one second for a minimum degree of precision.",
  "group_title": "SRG-APP-000375-NDM-000300",
  "idents": {
    "legacy": [
      "SV-105589",
      "V-96451"
    ],
    "cci": [
      "CCI-001889"
    ]
  },
  "check_id": "C-17771r288294_chk",
  "check_content": "Review the Cisco router configuration to verify that it is compliant with this requirement as shown in the example below.\n\nhostname R3\nservice timestamps log datetime localtime\n\nIf the router is not configured to record time stamps that meet a granularity of one second, this is a finding.",
  "fixtext": "Configure the Cisco router to record time stamps that meet a granularity of one second as shown in the example below.\n\nRP/0/0/CPU0:R3(config)#service timestamps log datetime localtime",
  "fix_id": "F-17768r288295_fix",
  "VulnDiscussion": "Without sufficient granularity of time stamps, it is not possible to adequately determine the chronological order of records. Time stamps generated by the application include date and time. Granularity of time measurements refers to the degree of synchronization between information system clocks and reference clocks.",
  "Documentable": "false"
}
