{
  "vuln_id": "V-257841",
  "rule_id": "SV-257841r1044914_rule",
  "stig_id": "RHEL-09-215090",
  "severity": "medium",
  "severity_category": "CAT II",
  "weight": "10.0",
  "title": "RHEL 9 must have the rng-tools package installed.",
  "group_title": "SRG-OS-000480-GPOS-00227",
  "idents": {
    "cci": [
      "CCI-000366"
    ]
  },
  "check_id": "C-61582r1044913_chk",
  "check_content": "Verify that RHEL 9 has the rng-tools package installed with the following command:\n\n$ dnf list --installed rng-tools\n\nExample output:\n\nrng-tools.x86_64          6.14-2.git.b2b7934e.el9\n\nIf the \"rng-tools\" package is not installed, this is a finding.",
  "fixtext": "The rng-tools package can be installed with the following command:\n \n$ sudo dnf install rng-tools",
  "fix_id": "F-61506r925509_fix",
  "VulnDiscussion": "\"rng-tools\" provides hardware random number generator tools, such as those used in the formation of x509/PKI certificates.",
  "Documentable": "false"
}
