{
  "vuln_id": "V-270749",
  "rule_id": "SV-270749r1137695_rule",
  "stig_id": "UBTU-24-600140",
  "severity": "low",
  "severity_category": "CAT III",
  "weight": "10.0",
  "title": "Ubuntu 24.04 LTS must restrict access to the kernel message buffer.",
  "group_title": "SRG-OS-000138-GPOS-00069",
  "idents": {
    "cci": [
      "CCI-001090"
    ]
  },
  "check_id": "C-74782r1067179_chk",
  "check_content": "Verify Ubuntu 24.04 LTS is configured to restrict access to the kernel message buffer with the following command:\n\n$ sysctl kernel.dmesg_restrict\nkernel.dmesg_restrict = 1\n\nIf \"kernel.dmesg_restrict\" is not set to \"1\" or is missing, this is a finding.\n\nVerify there are no configurations that enable the kernel dmesg function:\n\n$ sudo grep -r kernel.dmesg_restrict /run/sysctl.d/* /etc/sysctl.d/* /usr/local/lib/sysctl.d/* /usr/lib/sysctl.d/* /lib/sysctl.d/* /etc/sysctl.conf 2> /dev/null\n/etc/sysctl.d/10-kernel-hardening.conf:kernel.dmesg_restrict = 1\n\nIf any instance of \"kernel.dmesg_restrict\" is uncommented and set to \"0\", or if conflicting results are returned, this is a finding.",
  "fixtext": "Configure Ubuntu 24.04 LTS to restrict access to the kernel message buffer.\n\nSet the system to the required kernel parameter by adding or modifying the following line in /etc/sysctl.conf or a config file in the /etc/sysctl.d/ directory:\n\n     kernel.dmesg_restrict = 1\n\nRemove any configurations that conflict with the above from the following locations: \n     /run/sysctl.d/\n     /etc/sysctl.d/\n     /usr/local/lib/sysctl.d/\n     /usr/lib/sysctl.d/\n     /lib/sysctl.d/\n     /etc/sysctl.conf\n\nReload settings from all system configuration files with the following command:\n\n     $ sudo sysctl --system",
  "fix_id": "F-74683r1066735_fix",
  "VulnDiscussion": "Restricting access to the kernel message buffer limits access only to root. This prevents attackers from gaining additional system information as a nonprivileged user.",
  "Documentable": "false"
}
