{
  "vuln_id": "V-244550",
  "rule_id": "SV-244550r1017350_rule",
  "stig_id": "RHEL-08-040209",
  "severity": "medium",
  "severity_category": "CAT II",
  "weight": "10.0",
  "title": "RHEL 8 must prevent IPv4 Internet Control Message Protocol (ICMP) redirect messages from being accepted.",
  "group_title": "SRG-OS-000480-GPOS-00227",
  "idents": {
    "cci": [
      "CCI-000366"
    ]
  },
  "check_id": "C-47825r833372_chk",
  "check_content": "Verify RHEL 8 will not accept IPv4 ICMP redirect messages.\n\nCheck the value of the default \"accept_redirects\" variables with the following command:\n\n$ sudo sysctl net.ipv4.conf.default.accept_redirects\n\nnet.ipv4.conf.default.accept_redirects = 0\n\nIf the returned line does not have a value of \"0\", a line is not returned, or the line is commented out, this is a finding.\n\nCheck that the configuration files are present to enable this network parameter.\n\n$ sudo grep -r net.ipv4.conf.default.accept_redirects /run/sysctl.d/*.conf /usr/local/lib/sysctl.d/*.conf /usr/lib/sysctl.d/*.conf /lib/sysctl.d/*.conf /etc/sysctl.conf /etc/sysctl.d/*.conf\n\n/etc/sysctl.d/99-sysctl.conf: net.ipv4.conf.default.accept_redirects = 0\n\nIf \"net.ipv4.conf.default.accept_redirects\" is not set to \"0\", is missing or commented out, this is a finding.\n\nIf conflicting results are returned, this is a finding.",
  "fixtext": "Configure RHEL 8 to prevent IPv4 ICMP redirect messages from being accepted.\n\nAdd or edit the following line in a system configuration file, in the \"/etc/sysctl.d/\" directory:\n\nnet.ipv4.conf.default.accept_redirects = 0\n\nRemove any configurations that conflict with the above from the following locations: \n/run/sysctl.d/*.conf\n/usr/local/lib/sysctl.d/*.conf\n/usr/lib/sysctl.d/*.conf\n/lib/sysctl.d/*.conf\n/etc/sysctl.conf\n/etc/sysctl.d/*.conf\n\nLoad settings from all system configuration files with the following command:\n\n$ sudo sysctl --system",
  "fix_id": "F-47782r858790_fix",
  "VulnDiscussion": "ICMP redirect messages are used by routers to inform hosts that a more direct route exists for a particular destination. These messages modify the host's route table and are unauthenticated. An illicit ICMP redirect message could result in a man-in-the-middle attack.\n\nThe sysctl --system command will load settings from all system configuration files. All configuration files are sorted by their filename in lexicographic order, regardless of which of the directories they reside in. If multiple files specify the same option, the entry in the file with the lexicographically latest name will take precedence. Files are read from directories in the following list from top to bottom. Once a file of a given filename is loaded, any file of the same name in subsequent directories is ignored.\n/etc/sysctl.d/*.conf\n/run/sysctl.d/*.conf\n/usr/local/lib/sysctl.d/*.conf\n/usr/lib/sysctl.d/*.conf\n/lib/sysctl.d/*.conf\n/etc/sysctl.conf",
  "Documentable": "false"
}
