{
  "vuln_id": "V-280982",
  "rule_id": "SV-280982r1165301_rule",
  "stig_id": "RHEL-10-200635",
  "severity": "medium",
  "severity_category": "CAT II",
  "weight": "10.0",
  "title": "RHEL 10 must be configured so that the file integrity tool verifies extended attributes.",
  "group_title": "SRG-OS-000404-GPOS-00183",
  "idents": {
    "cci": [
      "CCI-002475"
    ]
  },
  "check_id": "C-85543r1165299_chk",
  "check_content": "Verify RHEL 10 AIDE is configured to verify extended attributes with the following command:\n\n$ sudo grep -E '^[^#]*xattrs' /etc/aide.conf\nFIPSR = p+i+n+u+g+s+m+growing+acl+selinux+xattrs+sha512\n/usr/sbin/auditctl p+i+n+u+g+s+b+acl+xattrs+sha512\n/usr/sbin/auditd p+i+n+u+g+s+b+acl+xattrs+sha512\n/usr/sbin/ausearch p+i+n+u+g+s+b+acl+xattrs+sha512\n/usr/sbin/aureport p+i+n+u+g+s+b+acl+xattrs+sha512\n/usr/sbin/augenrules p+i+n+u+g+s+b+acl+xattrs+sha512\nDIR = p+i+n+u+g+acl+selinux+xattrs\n\nOpen the file and verify that no additional uncommented file and directory selection lines are missing the \"xattrs\" rule.\n\nIf the \"xattrs\" rule is not being used on all uncommented selection lines in the \"/etc/aide.conf\" file, or extended attributes are not being checked by another file integrity tool, this is a finding.",
  "fixtext": "Configure RHEL 10 so that the file integrity tool checks file and directory extended attributes.\n\nIf AIDE is installed, ensure the \"xattrs\" rule is present on all uncommented file and directory selection lists.",
  "fix_id": "F-85448r1165300_fix",
  "VulnDiscussion": "RHEL 10 installation media ships with an optional file integrity tool called Advanced Intrusion Detection Environment (AIDE). AIDE is highly configurable at install time. This requirement assumes the \"aide.conf\" file is under the \"/etc\" directory.\n\nExtended attributes in file systems are used to contain arbitrary data and file metadata with security implications.",
  "Documentable": "false"
}
