{
  "vuln_id": "V-234247",
  "rule_id": "SV-234247r1213341_rule",
  "stig_id": "SRG-APP-000516-UEM-100011",
  "severity": "medium",
  "severity_category": "CAT II",
  "weight": "10.0",
  "title": "The UEM Agent must be configured to perform one of the following actions upon an attempt to unenroll the mobile device from management: \n-prevent the unenrollment from occurring\n-wipe the device to factory default settings\n-wipe the work profile with all associated applications and data.",
  "group_title": "SRG-APP-000516",
  "idents": {
    "cci": [
      "CCI-000366"
    ]
  },
  "check_id": "C-37432r1212887_chk",
  "check_content": "Verify the UEM Agent performs one of the following actions upon an attempt to unenroll the mobile device from management: \n-prevent the unenrollment from occurring\n-wipe the device to factory default settings\n-wipe the work profile with all associated applications and data.\n\nIf the UEM Agent does not perform one of the following actions upon an attempt to unenroll the mobile device from management: \n-prevent the unenrollment from occurring\n-wipe the device to factory default settings\n-wipe the work profile with all associated applications and data\nthis is a finding.",
  "fixtext": "Configure the UEM Agent to perform one of the following actions upon an attempt to unenroll the mobile device from management: \n-prevent the unenrollment from occurring\n-wipe the device to factory default settings\n-wipe the work profile with all associated applications and data.",
  "fix_id": "F-37397r612048_fix",
  "VulnDiscussion": "Access control of mobile devices to DoW sensitive information or access to DoW networks must be controlled so that DoW data will not be compromised. The primary method of access control of mobile devices is via enrollment of authorized mobile devices on the UEM server. Therefore, the UEM server must have the capability to enforce a policy for this control.\n\nSatisfies: FMT_UNR_EXT.1.1",
  "Documentable": "false"
}
