{
  "vuln_id": "V-261415",
  "rule_id": "SV-261415r1038966_rule",
  "stig_id": "SLEM-05-653035",
  "severity": "medium",
  "severity_category": "CAT II",
  "weight": "10.0",
  "title": "SLEM 5 audit system must take appropriate action when the audit storage volume is full.",
  "group_title": "SRG-OS-000047-GPOS-00023",
  "idents": {
    "cci": [
      "CCI-000140"
    ]
  },
  "check_id": "C-65144r996655_chk",
  "check_content": "Verify SLEM 5 takes the appropriate action when the audit storage volume is full using the following command:\n\n     > sudo grep disk_full_action /etc/audit/auditd.conf\n     disk_full_action = HALT\n\nIf \"disk_full_action\" is not set to \"HALT\", \"SYSLOG\", or \"SINGLE\", is commented out, or is missing, this is a finding.",
  "fixtext": "Configure SLEM 5 to shut down by default upon audit failure.\n\nAdd or modify the following line in the \"/etc/audit/auditd.conf \" file: \n\ndisk_full_action = HALT  \n\nNote: If system availability has been determined to be more important, and this decision is documented with the information system security officer (ISSO), configure SLEM 5 to notify system administration staff and ISSO staff in the event of an audit processing failure by setting the \"disk_full_action\" to \"SYSLOG\" or \"SINGLE\".",
  "fix_id": "F-65052r996656_fix",
  "VulnDiscussion": "It is critical that when SLEM 5 is at risk of failing to process audit logs as required, it takes action to mitigate the failure. Audit processing failures include software/hardware errors, failures in the audit capturing mechanisms, and audit storage capacity being reached or exceeded. Responses to audit failure depend on the nature of the failure mode.\n\nWhen availability is an overriding concern, other approved actions in response to an audit failure are as follows: \n\n1) If the failure was caused by the lack of audit record storage capacity, SLEM 5 must continue generating audit records if possible (automatically restarting the audit service if necessary), overwriting the oldest audit records in a first-in-first-out manner.\n\n2) If audit records are sent to a centralized collection server and communication with this server is lost or the server fails, SLEM 5 must queue audit records locally until communication is restored or until the audit records are retrieved manually. Upon restoration of the connection to the centralized collection server, action should be taken to synchronize the local audit data with the collection server.",
  "Documentable": "false"
}
