{
  "vuln_id": "V-213440",
  "rule_id": "SV-213440r961092_rule",
  "stig_id": "WNDF-AV-000016",
  "severity": "medium",
  "severity_category": "CAT II",
  "weight": "10.0",
  "title": "Microsoft Defender AV must be configured to not allow override of behavior monitoring.",
  "group_title": "SRG-APP-000210",
  "idents": {
    "legacy": [
      "SV-89897",
      "V-75217"
    ],
    "cci": [
      "CCI-001170"
    ]
  },
  "check_id": "C-14665r820167_chk",
  "check_content": "Verify the policy value for Computer Configuration >> Administrative Templates >> Windows Components >> Microsoft Defender Antivirus >> Real-time Protection >> \"Configure local setting override for turn on behavior monitoring\" is set to \"Disabled\" or \"Not Configured\".\n \nProcedure: Use the Windows Registry Editor to navigate to the following key: \nHKLM\\Software\\Policies\\Microsoft\\Windows Defender\\Real-Time Protection\n\nCriteria: If the value \"LocalSettingOverrideDisableBehaviorMonitoring\" is REG_DWORD = 0, this is not a finding.\n\nIf the value does not exist, this is not a finding.\n\nIf the value is 1, this is a finding.",
  "fixtext": "Set the policy value for Computer Configuration >> Administrative Templates >> Windows Components >> Microsoft Defender Antivirus >> Real-time Protection >> \"Configure local setting override for turn on behavior monitoring\" to \"Disabled\" or \"Not Configured\".",
  "fix_id": "F-14663r823051_fix",
  "VulnDiscussion": "This policy setting configures a local override for the configuration of behavior monitoring. This setting can only be set by Group Policy. If this setting is enabled, the local preference setting will take priority over Group Policy. If this setting is disabled or not configured, Group Policy will take priority over the local preference setting.",
  "Documentable": "false"
}
