{
  "vuln_id": "V-255842",
  "rule_id": "SV-255842r961392_rule",
  "stig_id": "WBSP-AS-000590",
  "severity": "medium",
  "severity_category": "CAT II",
  "weight": "10.0",
  "title": "The WebSphere Application Server must allocate audit log record storage capacity in accordance with organization-defined log record storage requirements.",
  "group_title": "SRG-APP-000357-AS-000038",
  "idents": {
    "legacy": [
      "SV-95955",
      "V-81241"
    ],
    "cci": [
      "CCI-001849"
    ]
  },
  "check_id": "C-59515r876815_chk",
  "check_content": "Review System Security Plan documentation.\n\nIdentify the Audit Service Provider log size and rotation settings based on component log policy.\n\nFrom administrative console, click Security >> Security auditing >> Audit service provider.\n\nSelect each [audit_service_provider_name].\n\nIf \"Audit Log Size\" and \"Max Number of Audit Log Files\" are not configured as per the System Security Plan, this is a finding.",
  "fixtext": "Identify Audit Service Provider log size and history retention based on component log policy.\n\nDocument those values in the System Security Plan.\n\nFrom administrative console, click Security >> Security auditing >>Related Items>> Audit service provider >> [audit_service_provider_name].\n\nUnder Audit log file size specify the size of the file in MB as defined by your policy.\n\nUnder \"Maximum number of audit logs files\", specify the maximum number of logs you want to keep on the file system as defined by your policy.\n\nClick \"OK\".\n\nClick \"Save\".",
  "fix_id": "F-59458r876816_fix",
  "VulnDiscussion": "The proper management of log records not only dictates proper archiving processes and procedures be established, it also requires allocating enough storage space to maintain the logs online for a defined period of time.\n\nIf adequate online log storage capacity is not maintained, intrusion monitoring, security investigations, and forensic analysis can be negatively affected.\n\nIt is important to keep a defined amount of logs online and readily available for investigative purposes. The logs may be stored on the application server until they can be archived to a log system or, in some instances, a Storage Area Networks (SAN). Regardless of the method used, log record storage capacity must be sufficient to store log data when the data cannot be offloaded to a log system or SAN.",
  "Documentable": "false"
}
