{
  "vuln_id": "V-221876",
  "rule_id": "SV-221876r991589_rule",
  "stig_id": "OL07-00-040620",
  "severity": "medium",
  "severity_category": "CAT II",
  "weight": "10.0",
  "title": "The Oracle Linux operating system must not forward Internet Protocol version 4 (IPv4) source-routed packets by default.",
  "group_title": "SRG-OS-000480-GPOS-00227",
  "idents": {
    "legacy": [
      "SV-108595",
      "V-99491"
    ],
    "cci": [
      "CCI-000366"
    ]
  },
  "check_id": "C-23591r880643_chk",
  "check_content": "Verify the system does not accept IPv4 source-routed packets by default.\n\n     # grep -r net.ipv4.conf.default.accept_source_route /run/sysctl.d/* /etc/sysctl.d/* /usr/local/lib/sysctl.d/* /usr/lib/sysctl.d/* /lib/sysctl.d/* /etc/sysctl.conf 2> /dev/null\n     net.ipv4.conf.default.accept_source_route = 0\n\nIf \"net.ipv4.conf.default.accept_source_route\" is not configured in the /etc/sysctl.conf file or in any of the other sysctl.d directories, is commented out, or does not have a value of \"0\", this is a finding.\n\nCheck that the operating system implements the accept source route variable with the following command:\n\n     # /sbin/sysctl -a | grep net.ipv4.conf.default.accept_source_route\n     net.ipv4.conf.default.accept_source_route = 0\n\nIf the returned line does not have a value of \"0\", this is a finding.\n\nIf conflicting results are returned, this is a finding.",
  "fixtext": "Set the system to the required kernel parameter by adding the following line to \"/etc/sysctl.conf\" or a configuration file in the /etc/sysctl.d/ directory (or modify the line to have the required value):\n\n     net.ipv4.conf.default.accept_source_route = 0 \n\nIssue the following command to make the changes take effect:\n\n     # sysctl --system",
  "fix_id": "F-23580r880644_fix",
  "VulnDiscussion": "Source-routed packets allow the source of the packet to suggest that routers forward the packet along a different path than configured on the router, which can be used to bypass network security measures. This requirement applies only to the forwarding of source-routed traffic, such as when IPv4 forwarding is enabled and the system is functioning as a router.",
  "Documentable": "false"
}
