{
  "vuln_id": "V-260035",
  "rule_id": "SV-260035r949066_rule",
  "stig_id": "SRG-NET-000395-VVSM-00010",
  "severity": "medium",
  "severity_category": "CAT II",
  "weight": "10.0",
  "title": "The Enterprise Voice, Video, and Messaging Session Manager, when using locally stored user accounts, must automatically lock the account until the locked account is released by an administrator when three unsuccessful logon attempts in 15 minutes are exceeded.",
  "group_title": "SRG-NET-000395",
  "idents": {
    "cci": [
      "CCI-002238"
    ]
  },
  "check_id": "C-63766r949064_chk",
  "check_content": "Verify the Enterprise Voice, Video, and Messaging Session Manager, when using locally stored user accounts, automatically locks the account until released by an administrator when three unsuccessful logon attempts in 15 minutes are exceeded.\n\nIf the Enterprise Voice, Video, and Messaging Session Manager, when using locally stored user accounts, does not automatically lock the account until released by an administrator when three unsuccessful logon attempts in 15 minutes are exceeded, this is a finding.",
  "fixtext": "Configure the Enterprise Voice, Video, and Messaging Session Manager, when using locally stored user accounts, to automatically lock the account until released by an administrator when three unsuccessful logon attempts in 15 minutes are exceeded.",
  "fix_id": "F-63673r949065_fix",
  "VulnDiscussion": "By limiting the number of failed login attempts, the risk of unauthorized system access via user password guessing, otherwise known as brute forcing, is reduced. Limits are imposed by locking the account. \n\nThis applies to network elements that have the concept of a user account (e.g., VPN, ALG, and proxy) as well as devices that can control traffic flow based on access authorizations (firewalls, IDPS).",
  "Documentable": "false"
}
