{
  "vuln_id": "V-81265",
  "rule_id": "SV-95979r1_rule",
  "stig_id": "WBSP-AS-000810",
  "severity": "medium",
  "severity_category": "CAT II",
  "weight": "10.0",
  "title": "The WebSphere Application Server must be configured to encrypt log information.",
  "group_title": "SRG-APP-000126-AS-000085",
  "idents": {
    "cci": [
      "CCI-001350"
    ]
  },
  "check_id": "C-80963r2_chk",
  "check_content": "Review System Security Plan documentation.\n\nIf the System Security Plan does not specify the encryption of audit records, this requirement is NA.\n\nFrom the administrative console, click Security >> Security Auditing >> Audit record encryption configuration.\n\nIf the \"Enable encryption\" check box is not selected, this is a finding.",
  "fixtext": "From the administrative console, click Security >> Security Auditing >> Audit record encryption configuration.\n\nSelect the \"Enable encryption\" checkbox.\n\nSelect the keystore that contains the encrypting certificate from the drop-down menu or click \"New\" to create a new keystore.\n\nIf you are using an existing certificate to encrypt your audit records, ensure the Certificate in the keystore is selected and specify the intended certificate in the \"Certificate alias\" drop-down menu.\n\nIf you are generating a new certificate to encrypt your audit records, do NOT use the \"Create a new certificate in the selected keystore\" option, this will generate a SHA-1 signed certificate, which is not allowed.\n\nInstead, select Security >> SSL Certificate and key management >> KeyStores and Certificates.\n\nSelect the keystore that is associated with the server hosting the audit logs.\n\nSelect \"Personal Certificates\".\n\nSelect \"Create\".\n\nSelect either a CA-Signed or Chained Certificate based on your requirements.\n\nFill in the information required to generate the certificate.\n\nRestart the DMGR and all the JVMs.",
  "fix_id": "F-88045r3_fix",
  "VulnDiscussion": "Protection of log records is of critical importance. Encrypting log records provides a level of protection that does not rely on host-based protections that can be accidentally misconfigured, such as file system permissions. Cryptographic mechanisms are the industry-established standard used to protect the integrity of log data. An example of a cryptographic mechanism is the computation and application of a cryptographic-signed hash using asymmetric cryptography. Encryption of log records must be tempered with architecture designs that incorporate log data into SIEM systems that read and act upon log data. Some SIEM systems may not be able to decrypt encrypted log data so encrypting the logs could be detrimental to the incident response process. This must be taken into account and addressed in the security plan.",
  "Documentable": "false"
}
