{
  "vuln_id": "V-223499",
  "rule_id": "SV-223499r1001101_rule",
  "stig_id": "ACF2-ES-000810",
  "severity": "medium",
  "severity_category": "CAT II",
  "weight": "10.0",
  "title": "CA-ACF2 PWPHRASE GSO record must be properly defined.",
  "group_title": "SRG-OS-000266-GPOS-00101",
  "idents": {
    "legacy": [
      "V-97697",
      "SV-106801"
    ],
    "cci": [
      "CCI-004066"
    ]
  },
  "check_id": "C-25172r1001100_chk",
  "check_content": "From the ISPF Command Screen enter:\nACF\nSET CONTROL(GSO)\nLIST PWPHRASE\nIf the following options are in effect, this is not a finding.\n\nIf any of the options deviate from the following, this is a finding.\n\nThe GSO PWPHRASE record will conform to the following requirements.\n\nALPHA(1 or greater)\nHISTORY(10-32)\nMAXDAYS(1-60)\nMINDAYS(1)\nMINLEN(15-100)\nNUMERIC(1 or greater)\nSPECIAL(1 or greater)\nSPECLIST(character list)\nWARNDAYS(1-10)\n\nNote: The SPECLIST special characters will be specified at a minimum. Characters will conform to the allowable list defined in CA ACF2 for z/OS Administration Guide.",
  "fixtext": "Configure the PWPHRASE GSO values to be set to the values specified.\n\nEnsure the GSO PWPHRASE record values conform to the following requirements:\n\nALPHA(1 or greater)\nHISTORY(10-32)\nMAXDAYS(1-60)\nMINDAYS(1)\nMINLEN(15-100)\nNUMERIC(1 or greater)\nSPECIAL(1 or greater)\nSPECLIST(character list)\nWARNDAYS(1-10)\n\nNote: The SPECLIST special characters will be specified at a minimum. Characters will conform to the allowable list defined in CA ACF2 for z/OS Administration Guide.\n\nExample:\nSET C(GSO)\nINSERT PWPHRASE NOALLOW ALPHA(1) HISTORY(10) MAXDAYS(60) MINDAYS(1) MINLEN(15) NUMERIC(1) SPECIAL(1) SPECLIST(& * =) WARNDAYS(10)\n\nF ACF2,REFRESH(PWPHRASE)",
  "fix_id": "F-25160r504598_fix",
  "VulnDiscussion": "Use of a complex password helps to increase the time and resources required to compromise the password. Password complexity or strength is a measure of the effectiveness of a password in resisting attempts at guessing and brute-force attacks.\n\nPassword complexity is one factor in determining how long it takes to crack a password. The more complex the password, the greater the number of possible combinations that need to be tested before the password is compromised.\n\nSpecial characters are those characters that are not alphanumeric. Examples include: ~ ! @ # $ % ^ *.",
  "Documentable": "false"
}
