{
  "vuln_id": "V-213730",
  "rule_id": "SV-213730r879800_rule",
  "stig_id": "DB2X-00-008900",
  "severity": "medium",
  "severity_category": "CAT II",
  "weight": "10.0",
  "title": "DB2 must implement and/or support cryptographic mechanisms preventing the unauthorized disclosure of organization-defined information at rest on organization-defined information system components.",
  "group_title": "SRG-APP-000429-DB-000387",
  "idents": {
    "legacy": [
      "SV-89277",
      "V-74603"
    ],
    "cci": [
      "CCI-002476"
    ]
  },
  "check_id": "C-14951r295239_chk",
  "check_content": "Review the system documentation to determine whether the organization has defined the information at rest that is to be protected from disclosure; which must include, at a minimum, PII and classified information.\n\nIf the documentation indicates no information requires such protections, this is not a finding.\n\nDB2 native encryption can encrypt the data at rest; or third-party tools, like IBM Guardium, can provide encryption for data at rest.\n \nTo find if a database is encrypted with DB2 native encryption, run the following SQL Query:\nDB2> SELECT * FROM TABLE(SYSPROC.ADMIN_GET_ENCRYPTION_INFO())\n\nIf the value of Algorithm is NULL for the database, this is a finding. \n\nIf the database is not encrypted with native encryption or any third-party tool, this is a finding.",
  "fixtext": "To create the database using DB2 native encryption run the following command:\n\n  $db2 create db mydb encrypt\n\nSee the detailed instructions in link in the note section below to create the encrypted database.\n\nNote: Select the following link for details on how to set up DB2 native encryption:\nhttp://www-01.ibm.com/support/knowledgecenter/SSEPGG_10.5.0/com.ibm.db2.luw.admin.sec.doc/doc/t0061766.html?lang=en \n\nIf a third-party tool is used for database encryption (IBM highly recommends using IBM Guardium) use the third-party tool's specific check and fix.",
  "fix_id": "F-14949r295240_fix",
  "VulnDiscussion": "DBMSs handling data requiring \"data at rest\" protections must employ cryptographic mechanisms to prevent unauthorized disclosure and modification of the information at rest. These cryptographic mechanisms may be native to the DBMS or implemented via additional software or operating system/file system settings, as appropriate to the situation.\n\nSelection of a cryptographic mechanism is based on the need to protect the integrity of organizational information. The strength of the mechanism is commensurate with the security category and/or classification of the information. Organizations have the flexibility to either encrypt all information on storage devices (i.e., full disk encryption) or encrypt specific data structures (e.g., files, records, or fields). \n\nThe decision whether to employ cryptography is the responsibility of the information owner/steward, who exercises discretion within the framework of applicable rules, policies, and law.",
  "Documentable": "false"
}
