{
  "vuln_id": "V-207436",
  "rule_id": "SV-207436r958674_rule",
  "stig_id": "SRG-OS-000298-VMM-001050",
  "severity": "medium",
  "severity_category": "CAT II",
  "weight": "10.0",
  "title": "The VMM must provide the capability to immediately disconnect or disable remote access to the information system.",
  "group_title": "SRG-OS-000298",
  "idents": {
    "legacy": [
      "V-57073",
      "SV-71333"
    ],
    "cci": [
      "CCI-002322"
    ]
  },
  "check_id": "C-7693r365718_chk",
  "check_content": "Verify the VMM provides the capability to immediately disconnect or disable remote access to the information system.\n\nIf it does not, this is a finding.",
  "fixtext": "Configure the VMM to provide the capability to immediately disconnect or disable remote access to the information system.",
  "fix_id": "F-7693r365719_fix",
  "VulnDiscussion": "Without the ability to immediately disconnect or disable remote access, an attack or other compromise taking place would not be immediately stopped.\n\nVMM remote access functionality must have the capability to immediately disconnect current users remotely accessing the VMM and/or disable further remote access. The speed of disconnect or disablement varies based on the criticality of missions functions and the need to eliminate immediate or future remote access to organizational VMMs.\n\nThe remote access functionality (e.g., RDP) may implement features, such as automatic disconnect (or user-initiated disconnect), in case of adverse information based on an indicator of compromise or attack.",
  "Documentable": "false"
}
