{
  "vuln_id": "V-223423",
  "rule_id": "SV-223423r958472_rule",
  "stig_id": "ACF2-ES-000020",
  "severity": "medium",
  "severity_category": "CAT II",
  "weight": "10.0",
  "title": "The number of ACF2 users granted the special privilege PPGM must be justified.",
  "group_title": "SRG-OS-000080-GPOS-00048",
  "idents": {
    "legacy": [
      "V-97543",
      "SV-106647"
    ],
    "cci": [
      "CCI-000213"
    ]
  },
  "check_id": "C-25096r500399_chk",
  "check_content": "From the ISPF Command Shell enter:\nSET LID \nSET VERBOSE \nLIST IF(PPGM)\n\nIf the number of users granted the special privilege PPGM is strictly controlled and limited to systems programmer and operations personnel, this is not a finding.",
  "fixtext": "Ensure that access to the special privilege PPGM is kept to a minimum and limited to systems programmer and operations personnel.",
  "fix_id": "F-25084r500400_fix",
  "VulnDiscussion": "To mitigate the risk of unauthorized access to sensitive information by entities that have been issued certificates by DoD-approved PKIs, all DoD systems (e.g., web servers and web portals) must be properly configured to incorporate access control methods that do not rely solely on the possession of a certificate for access. Successful authentication must not automatically give an entity access to an asset or security boundary. Authorization procedures and controls must be implemented to ensure each authenticated entity also has a validated and current authorization. Authorization is the process of determining whether an entity, once authenticated, is permitted to access a specific asset. Information systems use access control policies and enforcement mechanisms to implement this requirement.\n\nAccess control policies include: identity-based policies, role-based policies, and attribute-based policies. Access enforcement mechanisms include: access control lists, access control matrices, and cryptography. These policies and mechanisms must be employed by the application to control access between users (or processes acting on behalf of users) and objects (e.g., devices, files, records, processes, programs, and domains) in the information system.",
  "Documentable": "false"
}
