{
  "vuln_id": "V-256096",
  "rule_id": "SV-256096r961863_rule",
  "stig_id": "RINP-DM-000064",
  "severity": "low",
  "severity_category": "CAT III",
  "weight": "10.0",
  "title": "The Riverbed NetProfiler must be configured to conduct backups of system-level information and system documentation, including security-related documentation, when changes occur or weekly, whichever is sooner.",
  "group_title": "SRG-APP-000516-NDM-000340",
  "idents": {
    "cci": [
      "CCI-000366",
      "CCI-000537",
      "CCI-000539"
    ]
  },
  "check_id": "C-59770r882794_chk",
  "check_content": "Review the SSP to determine the site's network device backup policy. \n\nCheck the NetProfiler backup log to verify regular backups are being performed.\n\nGo to System >> Backup.\n\nView if there is a recent backup.\n\nIf the site does not conduct backups of system-level information contained in the information system when changes occur, this is a finding.",
  "fixtext": "Manually back up via the configuration periodically in accordance with the SSP.\n\nGo to System >> Backup. \n\nEnter details about what information must be backed up, where it is backed up, and who is notified when the backup is completed.\n\nClick \"Run Backup\".",
  "fix_id": "F-59713r882795_fix",
  "VulnDiscussion": "System-level information includes default and customized settings and security attributes, including access control lists (ACLs) that relate to the network device configuration, as well as software required for the execution and operation of the device. Information system backup is a critical step in ensuring system integrity and availability. If the system fails and there is no backup of the system-level information, a denial-of-service condition is possible for all who use this critical network component.\n\nThis control requires the network device to support the organizational central backup process for system-level information associated with the network device. This function may be provided by the network device itself; however, the preferred best practice is a centralized backup rather than each network device performing discrete backups. \n\nThe backup feature securely copies traffic and configuration information to a specified backup system. NetProfiler cannot be configured to automatically run backups, but backups can be configured and run manually via the Backup page. Manually back up the system periodically in accordance with the site System Security Plan (SSP). NetExpress packet logs and index files are not backed up. Additionally, capture jobs are not restored if the backup and restore operations are performed from a physical NetExpress to a virtual edition or vice versa. The NetProfiler uses the SSH public key to connect to a backup server for running backups.\n\nSatisfies: SRG-APP-000516-NDM-000340, SRG-APP-000516-NDM-000341",
  "Documentable": "false"
}
