{
  "vuln_id": "V-221797",
  "rule_id": "SV-221797r958846_rule",
  "stig_id": "OL07-00-030560",
  "severity": "medium",
  "severity_category": "CAT II",
  "weight": "10.0",
  "title": "The Oracle Linux operating system must audit all uses of the semanage command.",
  "group_title": "SRG-OS-000392-GPOS-00172",
  "idents": {
    "legacy": [
      "V-99333",
      "SV-108437"
    ],
    "cci": [
      "CCI-000172",
      "CCI-002884"
    ]
  },
  "check_id": "C-23512r860868_chk",
  "check_content": "Verify the operating system generates audit records when successful/unsuccessful attempts to use the \"semanage\" command occur.\n\nCheck the file system rule in \"/etc/audit/audit.rules\" with the following command:\n\n$ sudo grep -w \"/usr/sbin/semanage\" /etc/audit/audit.rules\n\n-a always,exit -F path=/usr/sbin/semanage -F perm=x -F auid>=1000 -F auid!=unset -k privileged-priv_change\n\nIf the command does not return any output, this is a finding.",
  "fixtext": "Configure the operating system to generate audit records when successful/unsuccessful attempts to use the \"semanage\" command occur.\n\nAdd or update the following rule in \"/etc/audit/rules.d/audit.rules\":\n\n-a always,exit -F path=/usr/sbin/semanage -F perm=x -F auid>=1000 -F auid!=unset -k privileged-priv_change\n\nThe audit daemon must be restarted for the changes to take effect.",
  "fix_id": "F-23501r860869_fix",
  "VulnDiscussion": "Without generating audit records specific to the security and mission needs of the organization, it would be difficult to establish, correlate, and investigate the events relating to an incident or identify those responsible for one.\n\nAudit records can be generated from various components within the information system (e.g., module or policy filter).\n\nWhen a user logs on, the auid is set to the uid of the account that is being authenticated. Daemons are not user sessions and have the loginuid set to -1. The auid representation is an unsigned 32-bit integer, which equals 4294967295. The audit system interprets -1, 4294967295, and \"unset\" in the same way.\n\nSatisfies: SRG-OS-000392-GPOS-00172, SRG-OS-000463-GPOS-00207, SRG-OS-000465-GPOS-00209",
  "Documentable": "false"
}
